{
  "schema_version": 1,
  "book": 60,
  "chapter": 1,
  "verses": {
    "8": ["biblical-love"],
    "11": ["authority-of-the-bible"],
    "12": ["authority-of-the-bible"],
    "13": ["renewing-of-the-mind"],
    "17": ["gods-judgment"],
    "22": ["biblical-love"],
    "23": ["spiritual-rebirth"],
    "25": ["authority-of-the-bible", "word-of-god"]
  }
}
