{
  "schema_version": 1,
  "book": 21,
  "chapter": 9,
  "verses": {
    "9": ["mans-role"],
    "10": ["wisdom-origin"],
    "11": ["wisdom-origin"],
    "12": ["wisdom-origin"],
    "13": ["wisdom-origin"],
    "14": ["wisdom-origin"],
    "15": ["wisdom-origin"],
    "16": ["wisdom-origin"],
    "17": ["wisdom-origin"],
    "18": ["wisdom-origin"]
  }
}
