{
  "schema_version": 1,
  "book": 45,
  "chapter": 13,
  "verses": {
    "1": ["obey-government-laws"],
    "2": ["obey-government-laws"],
    "3": ["obey-government-laws"],
    "4": ["obey-government-laws"],
    "5": ["obey-government-laws"],
    "6": ["obey-government-laws"],
    "7": ["obey-government-laws"],
    "9": ["biblical-love"],
    "10": ["biblical-love", "non-resistance"],
    "13": ["wine"],
    "14": ["wine"]
  }
}
